id,context,english
ui.legend.claim.contending,"Map legend key, claim-pressure mode: a house holding some but not the most provinces on this body.","[Contending]"
ui.legend.claim.leading,"Map legend key, claim-pressure mode: the house currently leading the claim to this body.","[Leading]"
ui.legend.claim.out,"Map legend key, claim-pressure mode: a house with too few provinces to matter to the claim.","[Out of it]"
ui.legend.military.empty,"Map legend key, military mode: no troops standing in the province.","[Empty]"
ui.legend.military.others,"Map legend key, military mode: troops belonging to someone other than the player.","[Others]"
ui.legend.military.yours,"Map legend key, military mode: the player's own troops.","[Yours]"
ui.legend.my-control.direct,"Map legend key, my-realm mode: provinces the player's house holds itself.","[Held directly]"
ui.legend.my-control.further,"Map legend key, my-realm mode: provinces two or more steps down the chain of vassalage.","[Further down]"
ui.legend.my-control.outside,"Map legend key, my-realm mode: provinces outside the player's realm entirely.","[Not your realm]"
ui.legend.my-control.vassal,"Map legend key, my-realm mode: provinces held one step down the chain of vassalage.","[Through a vassal]"
ui.legend.order.loyal,"Map legend key, order mode: the highest band of provincial order.","[Loyal]"
ui.legend.order.restive,"Map legend key, order mode: low order, not yet in unrest.","[Restive]"
ui.legend.order.settled,"Map legend key, order mode: comfortable provincial order.","[Settled]"
ui.legend.order.unrest,"Map legend key, order mode: the province is in open unrest and counting down to revolt.","[In unrest]"
ui.legend.relations.friendly,"Map legend key, relations mode: the holder thinks well of the player's house.","[Friendly]"
ui.legend.relations.hostile,"Map legend key, relations mode: the holder thinks badly of the player's house.","[Hostile]"
ui.legend.relations.indifferent,"Map legend key, relations mode: the holder has no strong opinion of the player's house.","[Indifferent]"
ui.legend.relations.yours,"Map legend key, relations mode: the player's own holdings, which have no opinion to show.","[Yours]"
ui.legend.wealth.middling,"Map legend key, wealth mode: the middle of the range of provincial output.","[Middling]"
ui.legend.wealth.poor,"Map legend key, wealth mode: the lowest provincial output.","[Poor]"
ui.legend.wealth.rich,"Map legend key, wealth mode: the highest provincial output.","[Rich]"
ui.map-mode.claim.hint.held,"Province hover hint, claim-pressure mode. {holder} is a house name, {held} how many provinces it holds on this body, {total} how many there are.","[{holder} holds {held} of {total} provinces here]"
ui.map-mode.claim.hint.leading,"As ui.map-mode.claim.hint.held, but this house is currently leading the claim to the body.","[{holder} holds {held} of {total} provinces here — currently leading the claim]"
ui.map-mode.claim.hint.unclaimed,"Province hover hint, claim-pressure mode, when nobody holds the province.","[Unclaimed: it counts for nobody's claim]"
ui.map-mode.claim.value.unclaimed,"Value printed on an unheld province in claim-pressure mode. An em dash standing for no count.","[—]"
ui.map-mode.holder.hint.direct,"Province hover hint in the my-realm map mode, when the player's own house holds the province directly.","[Held directly by your house]"
ui.map-mode.holder.hint.held,"Province hover hint in the holder and great-house map modes. {holder} is a house or organisation name.","[Held by {holder}]"
ui.map-mode.holder.hint.lost,"Province hover hint in the holder map mode, when nobody holds the province — it has revolted or was never taken.","[Unclaimed — in revolt or never held]"
ui.map-mode.holder.hint.outside,"Province hover hint in the my-realm map mode, when the province is held outside the player's chain of vassalage. {holder} is a house or organisation name.","[{holder} — outside your realm]"
ui.map-mode.holder.hint.unclaimed,"Province hover hint in the my-realm map mode, when nobody holds the province.","[Unclaimed — answers to nobody]"
ui.map-mode.holder.hint.vassal.one,"Province hover hint when the province is held one step down the player's chain of vassalage. {holder} is a house or organisation name.","[Held by {holder}, 1 step down your chain of vassalage]"
ui.map-mode.holder.hint.vassal.other,"Plural form of ui.map-mode.holder.hint.vassal.one; {hops} is 2 or more.","[Held by {holder}, {hops} steps down your chain of vassalage]"
ui.map-mode.holder.value.direct,"Value printed on the province in the my-realm map mode when the player holds it directly. Kept short — it is drawn on the globe.","[direct]"
ui.map-mode.holder.value.vassal,"Value printed on the province in the my-realm map mode when a vassal holds it. {holder} is a house name. Kept short — it is drawn on the globe.","[via {holder}]"
ui.map-mode.military.hint.empty,"Province hover hint, military mode, when no troops are standing in the province.","[No troops standing here]"
ui.map-mode.military.hint.garrison,"Province hover hint, military mode. {men} is a troop count, {owner} the house whose force is strongest there.","[{men} men here, the strongest under {owner}]"
ui.map-mode.order.hint,"Province hover hint, order mode. {percent} is provincial order as a percentage; {pressure} is a phrase describing what is pushing on it.","[Order {percent}% — {pressure}]"
ui.map-mode.order.hint.revolt,"Second line of the order-mode hover hint, shown only when the province is in unrest and counting down. {days} is a number of days.","[In unrest: revolts in {days} days]"
ui.map-mode.relations.hint.opinion,"Province hover hint, relations mode. {holder} is a house name; {opinion} is a signed number such as +40 or -15.","[{holder} regards your house at {opinion}]"
ui.map-mode.relations.hint.unclaimed,"Province hover hint, relations mode, when nobody holds the province.","[Unclaimed]"
ui.map-mode.relations.hint.you,"Province hover hint, relations mode, for the player's own holdings.","[Your own holding]"
ui.map-mode.relations.value.you,"Value printed on the player's own provinces in relations mode. Kept short — it is drawn on the globe.","[you]"
ui.map-mode.wealth.hint,"Province hover hint, wealth mode. {output} is the province's monthly wealth output.","[Worth {output} wealth a month at full order]"
ui.situation.occupied.detail,"Body of the needs-attention item for an occupied province. {occupier} is a house name, {men} a troop count, {province} the province name.","[{occupier} has {men} men standing in {province}, and its order is falling while they remain.]"
ui.situation.occupied.headline,"Headline of the needs-attention item when someone else's troops are standing on the player's ground. Kept very short — it sits in a narrow strip.","[{province} occupied]"
ui.situation.restive.detail,"Body of the needs-attention item for a province with falling order. {percent} is provincial order as a percentage.","[Order in {province} has fallen to {percent}%. It will not recover unless you attend to it.]"
ui.situation.restive.headline,"Headline of the needs-attention item for a province whose order has fallen well below its starting level. Kept very short.","[{province} is restive]"
ui.situation.revolt.detail,"Body of the needs-attention item for a province about to revolt, naming the ways out.","[{province} is in open unrest. Garrison it, go there in person, or hold court to restore order before it throws you off.]"
ui.situation.revolt.headline,"Headline of the needs-attention item for a province counting down to revolt. {days} is a number of days; the d is an abbreviation for days. Kept very short.","[{province} revolts in {days}d]"
